"","prod_name","title","reviewer","review","date","ratings","type_of_purchase"
"630","faber-castell - castell 9000 art set pencil (pack of 6), green","i dont know how i learned without them","tiziana di palma","i dont know why in the world i waited so long to buy some good drawing pencils i have been sketching with whatever mechanical pencil i had in my bag for years with very little preference but the way that my sketches have improved with these pencils has been dramatic now i feel comfortable creating full pieces of art in shades of grey whereas before i would sketch lightly and then use other media to finish the piece after ten years of sketching with in retrospect a highly inferior product i feel confident that these are just what i needed to take the next step toward improvementthese are very high quality they arrive sharpened which is nice since im used to colored pencils that arrive in dozens and take hours to sharpen they sharpen well with a standard or high quality sharpener and the graphite even on the softer pencils is strong enough to not crack in the barrel a problem i had with some student grade pencils in high school art class the case is nice too and has a soft mattelike finish to the touch i imagine it will dent and prove less than perfect if thrust into a backpack pocket full of other materials but if kept in between notebooks it probably has a long life ahead of iti bought a set for my best friend and she is in love too this would make a great gift for any artist in your life and is a good investment for your own arsenal of supplies if you are an artists as well",2014-07-24,5,"verified purchase"
"631","faber-castell - castell 9000 art set pencil (pack of 6), green","like it","clement dutu","like it",2021-09-07,4,"verified purchase"
"632","faber-castell - castell 9000 art set pencil (pack of 6), green","its pretty good","placeholder","its very smooth",2023-08-26,5,"verified purchase"
"633","faber-castell - castell 9000 art set pencil (pack of 6), green","beautiful","sherald w","great to use good quality",2024-02-04,4,"verified purchase"
"634","faber-castell - castell 9000 art set pencil (pack of 6), green","wie beschrieben","melanie v d hooven","meine tochter bentige diese bleistifte fr den kunstunterricht sie erfllen die ansprche und es lsst sich wunderbar mit ihnen zeichnenin der box sind sie auch im ranzen gut verstaut",2023-10-29,5,"verified purchase"
"635","faber-castell - castell 9000 art set pencil (pack of 6), green","the better in the field","sk sarfaraj","considering the high end pencils like mars lumographs the faber castell is no less rather i find working with the b quiet comfortable and good it gives you a huge variety of texture over various gradiet to explore and work with moreover the faber castell  art set is a very useful range of drawing pencils ranging from h to b ensuring that there is plenty of choice to ensure a great range of tonesthey sharpen well and have very smooth coverage not at all gritty in use",2023-05-21,5,"verified purchase"
"636","faber-castell - castell 9000 art set pencil (pack of 6), green",NA,NA,NA,2023-04-07,5,"verified purchase"
"637","faber-castell - castell 9000 art set pencil (pack of 6), green","good quality at good price","karla","i will buy my second one soon",2023-05-31,5,"verified purchase"
"638","faber-castell - castell 9000 art set pencil (pack of 6), green","un must","bogdanursan","per chi come me adora disegnare soprattutto disegni tecnici avere una cos ampia variet di matite  un must",2020-12-13,5,"verified purchase"
"639","faber-castell - castell 9000 art set pencil (pack of 6), green","satisfied","mrs a mcquiston","pencils seem good quality nice set",2023-02-13,5,"verified purchase"
"640","faber-castell - castell 9000 art set pencil (pack of 6), green","good value","jim b","very satisfied",2024-01-11,4,"verified purchase"
"641","faber-castell - castell 9000 art set pencil (pack of 6), green","love this pack for the h h h pencils","deb b","this pack has the ones that go up to  h and i love this for drawing because you can get a delicate grey from the upper h pencilsfirst let me say that this brand is one of the best made around  even the higher h pencils arent scratchy and wont ruin your paper  how lovely is that  i used to use a different brand but they started sending their business to mexico and their pencils are worthlessthis brand is worth the  you will spend so dont fret about if you are making a bad decisionyou arentthe wood doesnt split or crack and stays firm around the pencil point  i carve off wood until some of my pencil tips are almost  or more inches the use fine sandpaper to give me sharp points for the best of details  you can see these in one of my above drawings",2020-08-17,4,"verified purchase"
"642","faber-castell - castell 9000 art set pencil (pack of 6), green","pens that delivers and a box to match","deb b","like most art supplies they dont come with any artistic abilitiesgood for noodling around tho and you have a good selection of different hardness to choose from to find your favouritethe pen are just pen although of high quality but its the attention to detail and the tin box that pushes me over to a  on this one great box that will last so you can keep your things in one place without it falling apart on you it is this level of additional detail you expect when geting brand names not just the higher pricepoint and nothing elseall that being said they are pens and pretty good ones from what my non artistic mind can tell",2021-12-15,5,"verified purchase"
"643","faber-castell - castell 9000 art set pencil (pack of 6), green","gooooooood","johan eklundh","gooooooood",2023-03-28,5,"verified purchase"
"644","faber-castell - castell 9000 art set pencil (pack of 6), green","ottime","hwang jun","kit completo di matite con varie durezze ottime davvero e pratiche da portare con se grazie al pratico astuccio in latta",2023-08-27,4,"verified purchase"
"645","faber-castell - castell 9000 art set pencil (pack of 6), green","excelente","silvia raffaele","llegaron en tiempo y bien gracias",2021-07-29,5,"verified purchase"
"646","faber-castell - castell 9000 art set pencil (pack of 6), green","los esenciales","liliana alvarez","tiene graduaciones esenciales para cualquier trabajo a grafito solo ocup un h extra la pigmentacin es buena y la punta no se rompi en ningn momento trabajando con delicadeza",2023-07-13,4,"verified purchase"
"647","faber-castell - castell 9000 art set pencil (pack of 6), green","five stars","ana sol","good quality sketching pencils",2017-01-04,5,"verified purchase"
"648","faber-castell - castell 9000 art set pencil (pack of 6), green","top","amazon customer","set de crayon pour faire des dessins rapide en noir et blanc pour en premire esquisse",2023-01-01,5,"verified purchase"
"649","faber-castell - castell 9000 art set pencil (pack of 6), green","alles super","g stphane","alles super",2023-03-25,5,"verified purchase"
"650","faber-castell - castell 9000 art set pencil (pack of 6), green","great","mrs bee","breakresistant lead due to secural bonding process svideal for drawing students artists and designerssuperior leads made of finely ground graphitepure pencils are smooth never scratchyset provides an ideal range of  different degrees of hardness containing one each hbbbbbb",2023-04-24,4,"verified purchase"
"651","bic - evolution triangle - triangular pencils with integrated eraser - hb - box of 12","not for correcting beginners","aine traynor","im disappointed i just wanted a triangle pencil for my grandson to correct his hold this is not clearly a triangular pencil  i should have ordered a jumbo pencil i cant reorder it would cost a fortune in delivery",2022-06-16,4,"verified purchase"
"652","bic - evolution triangle - triangular pencils with integrated eraser - hb - box of 12","boa qualidade","elisabete costa","gostei",2023-09-28,1,"verified purchase"
"653","bic - evolution triangle - triangular pencils with integrated eraser - hb - box of 12","rapportqualit prix excellent","simon","un lot de crayon  papier pratique et trs solide  la gomme en plus idal pour les enfants",2023-04-06,5,"verified purchase"
"654","bic - evolution triangle - triangular pencils with integrated eraser - hb - box of 12","qualitativ hochwertiges produkt","sawyer","bewertet werden die bic evolution triangle hb dreikant bleistifte mit radiergummi  er packverarbeitung  benutzungdie firma bic hat einen ergonomischen bleistift entwickelt der gut in der hand liegt das gewhlte material vom bleistift ist extrem robust dabei lsst sich die mine dennoch leicht anspitzender bleistift hat den hrtegrad hb eine mindeststrke von  mm und ist vollstndig ohne holz versehen interessant finde ich dass der hersteller angibt dass der ganze bleistift kaubestndig ist ich kenne das aus meiner schulzeit noch dass ich das gerne gemacht habe aber den holzgeschmack nicht mochtefaziteinen so robusten bleistift hatte ich bisher noch nicht in der hand zum testen habe ich einen der  bleistifte in der mitte zerbrochen der hersteller gibt an dass durch das holzfreie material das produkt nicht splittert bei meinem test konnte ich die behauptung des herstellers besttigen eine klare kaufempfehlung meinerseitswenn der beitrag euch gefallen hat wrde ich mich ber ein ntzlich freuen",2019-11-20,5,"verified purchase"
"655","bic - evolution triangle - triangular pencils with integrated eraser - hb - box of 12","impeccable","hugues payot","larticle command correspond parfaitement  mon attente",2023-06-09,5,"verified purchase"
"656","bic - evolution triangle - triangular pencils with integrated eraser - hb - box of 12","not dark enough","mr  mrs rkkp","the pencil was not like an hb pencil the text are too light when written",2021-04-19,5,"verified purchase"
"657","bic - evolution triangle - triangular pencils with integrated eraser - hb - box of 12","herstellerversprechen vollstndig eingehalten","vincent","hierzu gibt es relativ wenig zu sagen alles was bic hier schreibt stimmt und wurde vernnftig umgesetzt ergonomisch und bequem dank dreiecksform sehr stabile mine bei der ich keinen bruch feststellen konnte kunstharz splittert nicht wobei mir noch nie ein bleistift auseinandergebrochen ist made in europe frankreich untersttzt also die lokale wirtschafteinzig der radiergummi am ende ist wie fast bei jedem bleistift etwas hartsprde und radiert nicht so sauber wie man es sich wnscht hier habe ich aber noch keinen integrierten radiergummi gefunden der berzeugtoh und das anspitzen geht wegen dreiecksform und kunstharz nicht ganz so leicht von der hand wie sonst",2019-12-07,2,"verified purchase"
"658","bic - evolution triangle - triangular pencils with integrated eraser - hb - box of 12","boa qualidade","margarida","lpis de boa qualidade e a preo mais acessvel aqui no site o facto de serem triangulares ajuda na pega das crianas",2023-07-01,5,"verified purchase"
"659","bic - evolution triangle - triangular pencils with integrated eraser - hb - box of 12","estranhos","janey pereira","muito finos e desconfortveis por serem feitos de papel e no madeira so muito maleaveis parece que se vo partir ao escrever no so para mim",2022-05-17,5,NA
"660","bic - evolution triangle - triangular pencils with integrated eraser - hb - box of 12","breaks easily","bearbear","breaks very easily not just the pencil but the wood too they snap easily",2021-07-20,3,NA
"661","bic - evolution triangle - triangular pencils with integrated eraser - hb - box of 12","bonne prise en main","laureb","top au cp",2023-08-12,4,"verified purchase"
"662","bic - evolution triangle - triangular pencils with integrated eraser - hb - box of 12","liegen gut in der hand krftiger farbton","caro","getestet habe ich die bic evolution triangle hb dreikant bleistifte mit radiergummi im er packgeliefert werden die bleistifte in einer kleinen berwiegend orangenen papierverpackungdie bleistifte sind blau und dreieckig gestaltet an der oberen seite befindet sich ein kleiner radiergummi um kleine korrekturen unmittelbar vornehmen zu knnendie bleistifte liegen sehr gut in der hand ich nutze sie berwiegend beim lernen fr mein studium um dort bentigte zeichnungen anzufertigen graphen tabellen etcdie spitze des bleistiftes ist sehr robust und hlt lange auch nach dem anspitzen bricht sie nicht direkt abdie bleistifte sind krftig sodass man die gezogenen linien etc auf collegeblock papier gut erkennen kannder radiergummi ist fr kleine korrekturen sehr praktischwenn man eine komplette zeichnung radieren mchte sollte man aber trotzdem zu einem greren radiergummi greifenzusammenfassend bin ich mit meinen neuen bleistiften sehr zufrieden da sie gut in der hand liegen krftig und ergiebig sind sowie einen kleinen radiergummi enthalten deshalb von mir gerne die hchstpunktzahl",2019-12-14,5,"verified purchase"
"663","bic - evolution triangle - triangular pencils with integrated eraser - hb - box of 12","inga","inga","estn bien",2023-08-06,5,"verified purchase"
"664","bic - evolution triangle - triangular pencils with integrated eraser - hb - box of 12","y ras","teuf","ras",2023-07-23,5,"verified purchase"
"665","bic - evolution triangle - triangular pencils with integrated eraser - hb - box of 12","im grunde toll","andreas","die bic dreikant bleistifte evolution stellen erst auf den zweiten blick eine neue generation von bleistiften dardas was wie holz aussieht ist gar kein holz sondern kunstharzden unterschied sprt man weder beim gebrauch noch beim spitzen denn das ist alles wie gehabtdie hbmine ist jedoch eine ganz normale bleistiftmine von guter qualittdass sie in der kunstharzhlle besser geschtzt ist als in einer holzhlle konnte ich bei normaler verwendung nicht feststellender bleistiftkper ist mit blauem metalliclack berzogen sieht ganz schick ausam hinteren ende befindet sich ein klassischer aufsatzradiergummi in wei wunder darf man von diesen radiergummis nicht erwarten bei intensivem gebrauch sind sie schnell aufgebraucht und nur noch die scharfkantige blechhlle ist brig und bei nur gelegentlichem gebrauch verschmutzen und verfetten die radiergummis und fangen an zu schmieren ich persnlich verwende stets einen ganz konventionellen bleistiftradiergummi in der gewohnten riegelformtrotzdem nur  sterne da mich im angebotstext etwas wirklich strtda steht dass beim kauen auf dem bleistift nichts absplittern kannalso bitte man soll nicht auf dem bleistift kauen und wer sich das wirklich nicht verkneifen kann der ist mit einem nicht lackierten echtholzbleistift bestimmt besser dranauf kunstharz herumkauen wirklichwie auch immer insgesamt ein ordentlicher bleistift der seine erwartete funktion hervorragend ausfhrt",2019-11-18,5,"verified purchase"
"666","bic - evolution triangle - triangular pencils with integrated eraser - hb - box of 12","pratique","lucky","pas chre pour ce produit j aime",2023-10-11,4,"verified purchase"
"667","bic - evolution triangle - triangular pencils with integrated eraser - hb - box of 12","ras","client damazon","ras",2023-08-05,4,"verified purchase"
"668","bic - evolution triangle - triangular pencils with integrated eraser - hb - box of 12","bien","mayalopez","fait son job",2023-07-20,4,"verified purchase"
"669","bic - evolution triangle - triangular pencils with integrated eraser - hb - box of 12","buena calidad","josesicilia","buena calidad",2023-06-06,4,NA
"670","bic - evolution triangle - triangular pencils with integrated eraser - hb - box of 12","perfecto para zurdos","isabel","perfecto para nio zurdo con  aos le costaba agarrar y con este lpiz lo adapta muy bien y sobre todo le gusta ms escribir",2023-03-23,4,NA
"671","bic - evolution triangle - triangular pencils with integrated eraser - hb - box of 12","para nios que no cogen bien el lapiz","julia","la tutora de nuestro hijo nos recomend lapuces triangulares para un mejor agarre y posicin de los dedos al escribir  y es cierto que funciona ayuda a sujetar el lpiz en una posicin correcta adems el precio me parece muy bueno",2023-01-08,4,"verified purchase"
"672","bic - evolution triangle - triangular pencils with integrated eraser - hb - box of 12","fidle  la marque","julie","de bonne qualit ergonomique et pas trop gros criture un peu paisse vu que mon fils appui fortement il nest jamais taill parfaitement sinon je le trouve trs bien",2023-01-17,5,"verified purchase"
"673","bic - evolution triangle - triangular pencils with integrated eraser - hb - box of 12","buena calidad","auxiliadora","me encantan",2023-06-01,5,"verified purchase"
"674","bic - evolution triangle - triangular pencils with integrated eraser - hb - box of 12","crayon solide","murielle maillot","crayon trs solidecouleur fonc et un bon prix",2023-03-10,5,"verified purchase"
"675","bic - evolution triangle - triangular pencils with integrated eraser - hb - box of 12","bons lpis","elsa gomes","os lpis escrevem bem apenas eu no estou habituada a lpis triangulares",2022-08-07,5,"verified purchase"
"676","bic - evolution triangle - triangular pencils with integrated eraser - hb - box of 12","me gusta que lleve incorporada la goma de borrar","juan i","prefiero el lpiz al bolgrafo porque corrijo muy a menudo las notas que escriboste es muy cmodoes cierto que quizs debiera marcarse un poco ms como dicen otros usuarios  pero para m no es un problema",2022-09-29,4,"verified purchase"
"677","bic - evolution triangle - triangular pencils with integrated eraser - hb - box of 12","trs bonne qualit","laure","trs bonne qualit prix correct",2023-03-14,5,"verified purchase"
"678","bic - evolution triangle - triangular pencils with integrated eraser - hb - box of 12","super","mriam","trs solide bonne qualit et super pour un enfant de  ans qui aprend  tenir le crayon",2022-12-03,5,"verified purchase"
"679","bic - evolution triangle - triangular pencils with integrated eraser - hb - box of 12","muy cmodos para nios pequeos","pury","escriben muy bien no se les rompe la punta fcilmente y cmodos de usar para los nios",2022-11-03,5,"verified purchase"
"680","bic - evolution triangle - triangular pencils with integrated eraser - hb - box of 12","lpices de buena calidad","salva amaya","buena calidad y buen precio lo recomiendo",2022-12-08,5,"verified purchase"
"681","bic - evolution triangle - triangular pencils with integrated eraser - hb - box of 12","relacin calidadprecio","ana maria paramio sanchez","econmicos y buenos",2023-01-10,4,"verified purchase"
"682","bic - evolution triangle - triangular pencils with integrated eraser - hb - box of 12","parfait","katia","original et bonne prise en main pour un enfant",2022-10-02,5,"verified purchase"
"683","bic - evolution triangle - triangular pencils with integrated eraser - hb - box of 12","como de usar y ms con gomita incorporada","norma","esta bien clidad media alta lpiz cmodo de sutetar y sper prctico con la goma incorporadaasin es menos probable q los peques pierdan la goma jeje",2021-05-30,5,"verified purchase"
"684","bic - evolution triangle - triangular pencils with integrated eraser - hb - box of 12","buen producto","el turu","son bastante cmodos y pintan bien",2022-11-10,4,"verified purchase"
"685","bic - evolution triangle - triangular pencils with integrated eraser - hb - box of 12","lapices ergonomicos","ainhoa","lapices faciles de coger al tener menos caras buena relacion calidad precio llegaron rpidos",2022-09-04,5,"verified purchase"
"686","bic - evolution triangle - triangular pencils with integrated eraser - hb - box of 12","lpices buenos","cayetana","buenos lapiceros para los nios cuando ya saben escribircmodos para colocar los dedosles doy un  porque para mi gusto pintan un poco flojo aunque al borrar no deja marca",2021-02-16,5,"verified purchase"
"687","bic - evolution triangle - triangular pencils with integrated eraser - hb - box of 12","buen agarre","gonzalo andres","escriben muy suave al ser en forma triangular se agarra mejor",2022-08-09,4,"verified purchase"
"688","bic - evolution triangle - triangular pencils with integrated eraser - hb - box of 12","funcional","diego zambrano","lpices de calidad goma funcional",2022-09-30,5,"verified purchase"
"689","bic - evolution triangle - triangular pencils with integrated eraser - hb - box of 12","demasiado duros para uso escolar","caribei","dejan demasiado rastro al borrar por lo que no considero que sean aptos para uso escolar  apenas pueden borrarse",2023-02-13,5,"verified purchase"
"690","bic - evolution triangle - triangular pencils with integrated eraser - hb - box of 12","estupendos","diana carpio","muy buenos",2022-09-19,2,"verified purchase"
"691","bic - evolution triangle - triangular pencils with integrated eraser - hb - box of 12","plutot bien","w","ras si ce nest niveau solidit cest plutot bien mais on se rend bien compte que ca ne demanderai pas grand chose pour casser",2020-04-17,4,"verified purchase"
"692","bic - evolution triangle - triangular pencils with integrated eraser - hb - box of 12","cris trs bien","legofans","trs bienmais les gommes partent vite",2020-07-03,4,"verified purchase"
"693","bic - evolution triangle - triangular pencils with integrated eraser - hb - box of 12","crayon","nicolas","trs bon crayon je trouve que j cris bien avec ",2021-08-22,4,"verified purchase"
"694","bic - evolution triangle - triangular pencils with integrated eraser - hb - box of 12","muy claritos al escribir","david","escriben muy claro mi hijo que aun no tiene mucha fuerza en la mano para escribir sale muy clarito el color del grafito no se si los compraria de nuevo",2020-12-11,5,"verified purchase"
"695","bic - evolution triangle - triangular pencils with integrated eraser - hb - box of 12","buenos","beatriz","buenos lapiceros para mi gusto pintan un poco flojos pero seguro que son as",2020-05-03,3,"verified purchase"
"696","bic - evolution triangle - triangular pencils with integrated eraser - hb - box of 12","con estos lapices sete acabaron los problemas","jose antonio","son lpices muy buenos para el agetreo de mis nietas en el colegio y para la oficina son fuertes y duraderos los recomiendo calidad y precio",2020-10-22,4,"verified purchase"
"697","bic - evolution triangle - triangular pencils with integrated eraser - hb - box of 12","se rompe con facilidad","hectorcb","compr estos lapices para un centro de estudios y he quedado muy decepcionado se rompen con facilidad la mina al hacer punta sale como rota o agrietada que impide una buena escritura poco aconsejables",2022-02-21,5,"verified purchase"
"698","bic - evolution triangle - triangular pencils with integrated eraser - hb - box of 12","todo fenomenal","lola","son buenos lpices llegaron rpido y perfecto estado todo",2021-09-04,2,"verified purchase"
"699","bic - evolution triangle - triangular pencils with integrated eraser - hb - box of 12","funcionan genial","soraya","no se rompe al sacar punta",2021-10-23,5,"verified purchase"
"700","bic - evolution triangle - triangular pencils with integrated eraser - hb - box of 12","bien","dienis veronique","livraison rapide conforme au descriptif",2020-03-10,5,"verified purchase"
"701","staedtler 7755abk25d mars micro mechanical pencil, 0.5mm (blistercard of 1 + 12 hb lead refills)","excelente artculo","es un reloj muy bonito lleg en excelentes condiciones","es uno de los lapiceros ms durables y de muy buena calidad lo recomiendo ampliamente fue una excelente compra",2023-12-30,4,"verified purchase"
"702","staedtler 7755abk25d mars micro mechanical pencil, 0.5mm (blistercard of 1 + 12 hb lead refills)","my favourite mechanical pencil","samuel j","this is my third pencil now of this modelmy first one was stolen by my sister she had one herself but she wanted to take mine on a university trip which involved a lot of time out in the field when she got back she conveniently lost my pencil and not her own i had grounds to believe that it was actually her pencil she lost  which i was eventually proved right when she confessed to her crimeanyway the tension got so heated at one point that she bought me a new one right there on the spot i should add that this argument went on for months i simple wanted a confession thats how much these mechanical pencils mean to uswith my second copy we went the distance together what makes these pencils so great is that they just have this perfect weight and feel it genuinely feels like quality and its rare to find all of the graphite broken inside you can really hit the darker tones of the hb quite effortlessly while being just as able to be used lightly and for speed taking notesi used my first copy back when i was at university i had to do a lot of technical drawings of architecture or infrastructure and i can honestly say that it always allowed me to deliver the quality of drawing that i had in mind my second copy was mostly used for a lot of notetaking and the occasional drawingmy new copy as displayed in the photograph is mostly unused for now i only bought this particular asin because it came with the additional graphite this is only a couple of quid more expensive than just buying the supplies individually  so i figured why not have a backupin any case i am prepared this time if my sister plans on another heist",2018-09-13,5,"verified purchase"
"703","staedtler 7755abk25d mars micro mechanical pencil, 0.5mm (blistercard of 1 + 12 hb lead refills)","excellent pencil for people who regularly use pencils","samuel j","it is a great pencil  and the best feature is the rectractable lead sleeve and the pencil feels good in hand and sturdy  it doesnt feel like its made of cheap plastic  and it has a staisfying click to it",2019-11-23,5,"verified purchase"
