"","prod_name","title","reviewer","review","date","ratings","type_of_purchase"
"1210","multi-talented pencil - stabilo woody 3 in 1 - pack of 10 - assorted colours with sharpener","great for artists of all ages","claudia","these are great tools for artists of all ages with a pleasant hand feel very versatile at mark making can be used dry or like watercolour pastels and blend with water great for making bold and impactful art",2023-09-02,4,"verified purchase"
"1211","multi-talented pencil - stabilo woody 3 in 1 - pack of 10 - assorted colours with sharpener","unsere kinder lieben den stift am meisten spass macht es ihnen die scheiben zu bezahlen","s","die stabilo woody  in  buntstifte wasserfarben und wachsmalkreiden im er pack mit spitzer berzeugen durch ihre vielseitige anwendbarkeit und lebendige farbauswahl die stifte liegen angenehm in der hand und ermglichen przises malen sowie kreative farbmischungen die wasserlslichen eigenschaften erffnen neue gestaltungsmglichkeiten whrend die wachsmalkreiden fr intensive farbergebnisse sorgen der mitgelieferte spitzer rundet das gesamtpaket ab und die zehn verschiedenen farben bieten eine breite palette fr knstlerische entfaltung die hochwertige qualitt und die langlebigkeit machen die stabilo woody  in  zu einer erstklassigen wahl fr kreative kpfe jeden alters",2023-11-18,4,"verified purchase"
"1212","multi-talented pencil - stabilo woody 3 in 1 - pack of 10 - assorted colours with sharpener",NA,"nadia saada","ottimi",2024-02-11,5,"verified purchase"
"1213","multi-talented pencil - stabilo woody 3 in 1 - pack of 10 - assorted colours with sharpener","mrite  toiles","loic laguerre","trs beaux crayons de couleurs taille idal pour les enfants en bas ge  trs robustes ils peuvent appuys ils ne scrasent pas  vous pouvez mme color une feuille en noir et repasser dessus avec une autre couleur et sa fonctionne hyper bien ne tache pas  et si vous ajouter de leau avec un pinceau cela se transforme en peinture idal aussi pour les tableaux sur pieds cot tableau blanc mieux que des feutres je recommande   fourni avec un gros taille crayons qui va parfaitement  couleurs intenses sans forcer  cliquer sur mon commentaire si vous avez trouv cela utile ",2023-08-11,5,"verified purchase"
"1214","multi-talented pencil - stabilo woody 3 in 1 - pack of 10 - assorted colours with sharpener","liegt gut in kinderhnden schne farben","loic laguerre","ich habe lange berlegt welche buntstifte ich fr mein kind bestellen mchtedie stifte sind okay verpackt ich bin eher der typ mensch dem eine verpackung gefllt die langlebiger ist und die stifte sicher verpackt sinddie stifte liegen gut in der kinderhand und die farben sind schn",2024-01-21,5,"verified purchase"
"1215","multi-talented pencil - stabilo woody 3 in 1 - pack of 10 - assorted colours with sharpener","great product for kids who loves to draw","bv","great colour great fun good size for little learners my  year old loved it right away and easy to wash off any surface ",2021-04-21,5,"verified purchase"
"1216","multi-talented pencil - stabilo woody 3 in 1 - pack of 10 - assorted colours with sharpener","love these","michal turoci","pricey but great product last and can use of all sorts of surfaces keep the kids happy for a bit",2023-09-16,5,"verified purchase"
"1217","multi-talented pencil - stabilo woody 3 in 1 - pack of 10 - assorted colours with sharpener","robust unterschiedliche funktionensuper fr kinder","j hill","man kann mit diesen stiften auf glas malen zb fenster man kann jedoch auch ganz normal auf papier malen die  funktion ist  mit wasser mglich die farben mssen etwas dicker auf dem blatt sein und dann kann mit wasser dann ein aquarellartiges bild entstehendie stifte sind super fr kinderhnde geeignet da mein sohn  oft sachen durch die gegend wirft brechen die meisten mienen das ist hier absolut nicht der fall jetzt nach monat testen kann ich sagen alle stifte sind noch heile dadurch dass hier ein anspitzer bei war lassen sich die stifte prima wieder in die ursprungsform bringen und die kinder knnen wieder weiter malenhier jedoch das  warum ich einen stern abgezogen habe vorsicht bei dem roten stift an der fensterfrontdas gummi am fenster ist beim abwischen etwas rosa geworden und ich habe es noch nicht wegbekommen falls jemand eine idee hat mit welchem mittel das mglich ist gerne eine info geben ",2024-02-01,5,"verified purchase"
"1218","multi-talented pencil - stabilo woody 3 in 1 - pack of 10 - assorted colours with sharpener","absolut zu empfehlen  wenn man kinder hat","manni","die stifte sind sehr vielfltig nutzbar  absolut super fr kidsdie stifte lassen sich auch feucht abwischen von zb tapeten und putzein must have fr alle eltern",2024-02-12,5,"verified purchase"
"1219","multi-talented pencil - stabilo woody 3 in 1 - pack of 10 - assorted colours with sharpener","besten stifte fr kleinkinder","amazon kunde","besten stifte fr kleinkinder jedoch hoher verschlei  wurden schon xmal nachgekauft und auch verschenktbis jetzt hat mich jede mama auf diese stifte angesprochen und nachgekauft",2024-02-09,4,"verified purchase"
"1220","multi-talented pencil - stabilo woody 3 in 1 - pack of 10 - assorted colours with sharpener","gutes mahlergebnis","b","die stifte malen sehr schn sie sind so fr kleine hnde gut geeignet da man auch mit sehr leichtem druck die farben gut siehtdie stifte gehen gut wieder von den fliesen tischdecke oder fenster mit einem feuchten tuch abwischen",2024-01-30,5,"verified purchase"
"1221","multi-talented pencil - stabilo woody 3 in 1 - pack of 10 - assorted colours with sharpener","tolle mglichkeit fr einstieg","denise k","tolle stifte fr den anfang wenn sich die kinder noch alles in den mund stecken da sie durchgehend mit holz ummantelt sind muss man nur darauf achten dass sich die kinder nicht die spitze in den mund stehen",2024-01-31,4,"verified purchase"
"1222","multi-talented pencil - stabilo woody 3 in 1 - pack of 10 - assorted colours with sharpener","genial","khal","parfait pour mon enfant qui a tendance  appuyer fort sur les mines des crayons classiques trs rsistant",2024-01-29,5,"verified purchase"
"1223","multi-talented pencil - stabilo woody 3 in 1 - pack of 10 - assorted colours with sharpener","leicht abwaschbar","anonym","sind super fr kleinkinder und auf dem boden  leicht abgewischt",2024-02-11,5,"verified purchase"
"1224","multi-talented pencil - stabilo woody 3 in 1 - pack of 10 - assorted colours with sharpener","perfekt fr u kinder","amazon kunde","fr die kita bestellt wir schwren auf die stifte und die kinder lieben sie",2024-02-09,5,"verified purchase"
"1225","multi-talented pencil - stabilo woody 3 in 1 - pack of 10 - assorted colours with sharpener","top teil","eike s","die kinder lieben sie und wollen mehr davon",2024-02-13,5,"verified purchase"
"1226","multi-talented pencil - stabilo woody 3 in 1 - pack of 10 - assorted colours with sharpener","super","alexander degoutrie","toll stifte",2024-02-10,5,"verified purchase"
"1227","multi-talented pencil - stabilo woody 3 in 1 - pack of 10 - assorted colours with sharpener","stifte","amazon kunde","gute ware zum vernnftigen preis",2024-02-11,5,"verified purchase"
"1228","multi-talented pencil - stabilo woody 3 in 1 - pack of 10 - assorted colours with sharpener","tolles produkt","marc lehmann","die stifte bieten malfreude fr die ganze familie nachdem die kleinsten damit gern auch einmal auf mbel und wnde losgehen ist es perfekt dass die farbe mit wasser wieder aus und abwaschbar ist",2024-01-13,5,"verified purchase"
"1229","multi-talented pencil - stabilo woody 3 in 1 - pack of 10 - assorted colours with sharpener","stifte fr die kleinen","n schmidt","ich bin begeistert von den stiften schne farben leichte handhabung anspitzer ist gleich dabei wenn mal ber den blattrand hinausgemalt wird ist es leicht abwischbar auf verschiedenen oberflchen wie zum beispiel holztisch laminat steinboden spielematte auch abwischbar von puppen wenn es auf die kleidung kommt ist die farbe beim nchsten waschgang weg",2024-01-05,5,"verified purchase"
"1230","multi-talented pencil - stabilo woody 3 in 1 - pack of 10 - assorted colours with sharpener","tolle stifte","jane","die stifte sind schn handlich so dass sie auch jhrige bereits benutzen knnen sie malen sehr gut mein sohn hat groen spa mit ihnen sehr praktisch ist dass sie auf fensterglas malen und sich auch einfach entfernen lassen genausogut klappt das auf unserer folie am esstisch mini malt und wir haben noch ein paar minuten lnger zum essenleider sind sie preislich sehr teuer wir ziehen sie dennoch gnstigeren alternativen vor",2024-01-22,5,"verified purchase"
"1231","multi-talented pencil - stabilo woody 3 in 1 - pack of 10 - assorted colours with sharpener","wie von stabilo erwartet  super","melissaf","sehr tolle stifte mit denen nicht nur unsere kleinste mit fast  jahren malt auch die greren geschwister greifen gerne zu diesen stiften finde den preis trotzdem recht teuer werde demnchst die gnstigere variante testen",2024-01-03,4,"verified purchase"
"1232","multi-talented pencil - stabilo woody 3 in 1 - pack of 10 - assorted colours with sharpener","erste stifte fr die kleinen","xy ungelst","wir haben die stifte seit dem zweiten geburtstag im einsatz sie sind fr kinder gut zu halten aufgrund ihrer dicke man kann damit auch auf glas zb fenster malen und es ist abwaschbar auch flecken aus kleidern gehen ohne probleme wieder raus",2023-12-27,5,"verified purchase"
"1233","multi-talented pencil - stabilo woody 3 in 1 - pack of 10 - assorted colours with sharpener","parfait","jerome","gros crayons facile dutilisation",2024-01-15,5,"verified purchase"
"1234","multi-talented pencil - stabilo woody 3 in 1 - pack of 10 - assorted colours with sharpener","super stifte fr kleinkindern","vanessa k","die stifte sind super fr kinder lassen sich berall gut abwischen selbst von wnden",2024-01-11,5,"verified purchase"
"1235","multi-talented pencil - stabilo woody 3 in 1 - pack of 10 - assorted colours with sharpener","schule","babsy","ist pnktlich angekommen war fr die schule meiner tochter",2024-01-17,5,"verified purchase"
"1236","multi-talented pencil - stabilo woody 3 in 1 - pack of 10 - assorted colours with sharpener","spitze","stiven","sehr gut und schnell und sauber verpackt dankeschn",2024-01-17,5,"verified purchase"
"1237","multi-talented pencil - stabilo woody 3 in 1 - pack of 10 - assorted colours with sharpener","kind war zufrieden","amazon kunde","wurde verschenkt aber das kind war zufrieden was will man mehr",2024-01-05,5,"verified purchase"
"1238","multi-talented pencil - stabilo woody 3 in 1 - pack of 10 - assorted colours with sharpener","malen super berall","pia","super stifte dass sie berall malen knnen kann aber auch schwierig werden gehen von fensterscheiben gut an vorsicht nur wenn kinder sie in den mund nehmen die farben sind sehr ergiebig ",2023-12-25,5,"verified purchase"
"1239","multi-talented pencil - stabilo woody 3 in 1 - pack of 10 - assorted colours with sharpener","beste kinderstifte","lissi","sehr empfehlenswert leicht weich und auch gut abwaschbar",2024-01-12,5,"verified purchase"
"1240","multi-talented pencil - stabilo woody 3 in 1 - pack of 10 - assorted colours with sharpener","super wachsmalstifte","ramona e","in der schule sind diese stifte erwnscht da die farben so schn leuchten und zu anderen wachsmalstiften einfach viel stabiler und einfach anzusetzen sind wie gesagt die qual der faben ist auch genialnachteilder anspitzer ist extrem gro und dick und bisher hab ich noch nicht gesehen das man den separat kaufen kann wobei in der  und  klasse gern mal dinge verschwindenauch ist die packung nicht gerade toll kinderhnde in der grundschule ziehen gern mal krftiger oder stopfen die stifte rein und schwups ist die packung gerissenansonsten total super",2023-11-10,5,"verified purchase"
"1241","multi-talented pencil - stabilo woody 3 in 1 - pack of 10 - assorted colours with sharpener","tolle stifte fr anfnger","andy","optimal fr die ersten malversuche",2024-01-08,4,"verified purchase"
"1242","multi-talented pencil - stabilo woody 3 in 1 - pack of 10 - assorted colours with sharpener","perfekte stifte fr malanfnger","nina","die stifte eignen sich ausgezeichnet um mit dem malen zu beginnen sie liegen gut in der hand sind formstabil und brechen nicht farbflecken gehen beim waschen gut raus auch bei  grad definitive weiterempfehlung",2023-12-16,5,"verified purchase"
"1243","multi-talented pencil - stabilo woody 3 in 1 - pack of 10 - assorted colours with sharpener","pnktlichkeit","raabe","das produkt eignet sich fr erwachsene als auch fr kinder sehr gute qualitt deckkraft auf verschiedenen materialien mglich die zustellung wie erwnscht  freundliche  pnktlich auf die minute und das paket nicht beschdigt ",2023-12-16,5,"verified purchase"
"1244","multi-talented pencil - stabilo woody 3 in 1 - pack of 10 - assorted colours with sharpener","toll fr kleinkinder","lilith","wir lieben diese stifte unsere zwerge malen sehr gerne damit toll dass man sie abwischen kann von vielen materialien",2023-12-28,5,"verified purchase"
"1245","multi-talented pencil - stabilo woody 3 in 1 - pack of 10 - assorted colours with sharpener","super","amazon kunde","die besten stifte fr kleine minihnde unser  jhriger liebt es damit zu malen",2023-12-29,5,"verified purchase"
"1246","multi-talented pencil - stabilo woody 3 in 1 - pack of 10 - assorted colours with sharpener","fr kleine kinderhnde perfekt","kathleen s","habe diese stifte in einem kinderbereich eines museums das erste mal gesehen und am gleichen tag selbst bestellt gerade kleine kinder knnen die stifte gut halten sie malen schn krftig und man braucht nicht viel kraft beim aufdrcken der anspitzer ist gleich dabei",2023-12-13,5,"verified purchase"
"1247","multi-talented pencil - stabilo woody 3 in 1 - pack of 10 - assorted colours with sharpener","tolle stifte fr kleine hnde","laura becker","die stifte haben wir fr meinen zweijhrigen neffen gekauft die stifte liegen wirklich gut in seiner kleinen hand die farbe verteilt sich auch ohne groen druck prima auf dem papier sehr zu empfehlen im kleinkindbereich",2023-12-19,5,"verified purchase"
"1248","multi-talented pencil - stabilo woody 3 in 1 - pack of 10 - assorted colours with sharpener","spitze fr kleinkinder","amazon kunde","tochter hat mega freude damit und wir auch dann beim putzen ",2024-01-28,5,"verified purchase"
"1249","multi-talented pencil - stabilo woody 3 in 1 - pack of 10 - assorted colours with sharpener","schne stifte aber vorsichtig mit plastikoberflchen","jessie van b","die stift sind wirklich toll man kann damit auf papier und auf der glasscheibe malen leider geht der stift ganz schlecht von plastikoberflchen ab also vorsichtig bei fensterrahmen ich habe es erst mit der chemiebombe wieder abbekommen",2024-01-04,4,"verified purchase"
"1250","multi-talented pencil - stabilo woody 3 in 1 - pack of 10 - assorted colours with sharpener","produit haut de gamme trs agrable","virginie","jai achet ces crayons sur recommandation de la matresse de maternelle de ma fille et je ne regrette pasla taille est trs adapte aux petites mains le trac sur papier est fluide avec de trs beau rendu de couleur mais l o ils sont le plus intressant cest  lutilisation sur support lisses sur la photo jai utilis une pochette transparente mais cela fonctionne aussi sur les vitres ou sur une petite table denfant laque ou recouverte dun film protge livre par exempleles possibilits sont infinies et un coup de lingette humide tout sefface et on peut recommenceron peut donc presque tout imaginerle critre prix reste assez limitant pour les paquets avec nombreuses couleurs mais avec le lot de  couleurs permets dj pleins de possibilit et cest un norme point positif car il est livr avec un taille crayon adaptbref je recommande si vous trouvez mon commentaire utile nhsitez pas  cliquer sur le bouton cidessous ",2023-09-13,4,"verified purchase"
"1251","royal & langnickel sketching artist pencils - set of 12 drawing pencils 5h to 6b","good product","winston zhang","i bought this product for a online art class and it worked perfectly and there was nothing i would change about the packaging or the product it came quickly and without any damage and it is very giftable  the packaging is very thin and slick and looked nice the pencils are great for shading and sketching this is a great product for the price and compared to more expensive pencils it works the same",2020-12-28,4,"verified purchase"
"1252","royal & langnickel sketching artist pencils - set of 12 drawing pencils 5h to 6b","as described","paula roberts","prompt delivery good value",2024-02-11,5,"verified purchase"
"1253","royal & langnickel sketching artist pencils - set of 12 drawing pencils 5h to 6b","buenoos","francisco miguel horrach estarellas","la ergonoma es un poco incmoda y los b son un poco borrosos",2023-03-18,4,"verified purchase"
"1254","royal & langnickel sketching artist pencils - set of 12 drawing pencils 5h to 6b","how the pencils wrote","sheila","i like that the lead wrote very softly  it did not skip  or have chips of the lead",2019-01-06,4,"verified purchase"
"1255","royal & langnickel sketching artist pencils - set of 12 drawing pencils 5h to 6b","great product","customer","my kid love it thanks eradistribution fast shipping and great services",2022-08-15,5,"verified purchase"
"1256","royal & langnickel sketching artist pencils - set of 12 drawing pencils 5h to 6b","matite non eccellenti per il disegno","daniela","ho acquistato queste matite per avere il set completo dato che le utilizzavo per laccademia per non mi  piaciuto molto come prodotto",2021-12-06,4,"verified purchase"
"1257","royal & langnickel sketching artist pencils - set of 12 drawing pencils 5h to 6b","bon rapport qualit prix","thauvin","je les utilise tout les jours pour dessinerdbutant amoureux des carntistes je les emmne partouta part un b dont la mine cest fragmente   lintrieur les autres tiennent le coup",2020-06-04,3,"verified purchase"
"1258","royal & langnickel sketching artist pencils - set of 12 drawing pencils 5h to 6b","excellent","mariapascal","easy to draw pencils just as expected high quality and good grip a little on the pricy side but as the quality is good i would definitely order more",2016-12-08,4,"verified purchase"
"1259","royal & langnickel sketching artist pencils - set of 12 drawing pencils 5h to 6b","good for starters","tanille roesler","im really glad i made the investment for real artist pencils having the different varieties of darkness has helped me a lot in the last couple months since i got them  i dont do that full greyscale shading stuff barely breaking ground into general shading no way i can do that  but it makes it a lot easier for my drawings because instead of how i did it before where i would just try to draw the basic shapes and general outline with pencil usually mechanical lightly and then as i went each new layer would be slightly darker with the permanent stuff that i would trace over with pen as the darkest but then when i inked the drawing let the ink dry and go back to erase before coloring it was often very difficult to get rid of all the pencil lines because of how hard and dark i had to go with some of them  but now with these artist pencils i lightly do the basic shapes with the lightest pencil and as i go up in layers i go one or two pencils up for a darker line with minimal effort amd barely any pressure  the result is a group of line in varying degrees of darkness that can still be easily erased once i have inked the final outline and i dont have pesky persistent lines and pressure spots showing through my color  plus because you are using multiple pencils per drawing they last a lot longer before needing to be sharpened  the one i used most the h lasted almost two full months before needing to be sharpened and i still havent sharpened any of the others  my only beef is a cpuple of them have one spot on the led where its kind of scratchy and instead of gliding over the paper i can feel it catching  these are a good set for a starter or someone who doesnt intend to do full greyscale art like me i doubt i will ever need to move up to a larger or higher end set than this one",2020-02-27,4,"verified purchase"
"1260","royal & langnickel sketching artist pencils - set of 12 drawing pencils 5h to 6b","ms de lo esperado","delegator reator","teniendo en cuenta que son unos lapices bastantes baratos estoy contento con sus resultadosinfluye mucho el tipo de papel que utilices para sacarles mayor partido",2020-10-19,4,"verified purchase"
"1261","royal & langnickel sketching artist pencils - set of 12 drawing pencils 5h to 6b","daughter used for art work","t irshad","good pencils",2024-01-12,4,"verified purchase"
"1262","royal & langnickel sketching artist pencils - set of 12 drawing pencils 5h to 6b","excellent value quality pencils","johan p","very pleased with these pencils as good as my staedtler pencils at less than half the price very nice feel and they sharpen well this set has a nice range  from b to hi highly recommend them",2019-12-04,5,"verified purchase"
"1263","royal & langnickel sketching artist pencils - set of 12 drawing pencils 5h to 6b","excellent value for money","lu","excellent value for money pencils with a good range of optionspros a good variety of presharpened pencils allowing for good quality drawing at a very low pricecons the plastic sleeve is useless youll need to keep them in a pencil case as the sleeve splits and falls apart quickly some of the pencils arrived blunted as though theyd already been usedoverall you get a good variety of high quality pencils for a very low price",2019-06-20,5,"verified purchase"
"1264","royal & langnickel sketching artist pencils - set of 12 drawing pencils 5h to 6b","muy normalitos","antonio","pintan bien pero no es la punta que buscaba me interesa punta apincelada y que se puedan fundir con otros colores",2020-10-29,5,"verified purchase"
"1265","royal & langnickel sketching artist pencils - set of 12 drawing pencils 5h to 6b","sketching pencils","aalyiss","i really do like them and im happy about my purchase it is low on pricing i shouldve bought some more it didnt take too long to arrive at my house",2023-10-05,3,"verified purchase"
"1266","royal & langnickel sketching artist pencils - set of 12 drawing pencils 5h to 6b","absolutely great","kyanna lenz","these are awesome pencils they dont break easily and have excellent color and quality definitely buying again",2019-01-23,5,"verified purchase"
"1267","royal & langnickel sketching artist pencils - set of 12 drawing pencils 5h to 6b","great","tashahorror","really good pencils for sketchingdrawing quality is pretty great i use them all the time",2022-10-07,5,"verified purchase"
"1268","royal & langnickel sketching artist pencils - set of 12 drawing pencils 5h to 6b","matite per ogni stile ma di livello medio","federico","matite in blocco ma aspetto decisamente economico",2021-02-10,5,"verified purchase"
"1269","royal & langnickel sketching artist pencils - set of 12 drawing pencils 5h to 6b","mes crayons de papiers complets  noirs","christine","pour mon travail dj mes  derniers crayons papier noirs mesuraient environ cm  en magasin javoue en avoir cherch mais ts les crayons papier tait coloris rouges ou autres  jai vite pens  vous et mes crayons de papier sont noirs avec la tige noire   je ne parlais pas de la mine bien sr mais de lexterieur du crayon de papier  merci ",2020-02-24,3,"verified purchase"
"1270","royal & langnickel sketching artist pencils - set of 12 drawing pencils 5h to 6b","great quality","sarah matthews","i hesitated about these until i read the reviews and i have to agree with the majority great quality for the price i store mine in a tin so the plastic holder isnt an issue for me",2021-12-08,5,"verified purchase"
"1271","royal & langnickel sketching artist pencils - set of 12 drawing pencils 5h to 6b","bon rapport qualit prix","nathalie","parfait",2020-12-23,4,"verified purchase"
"1272","royal & langnickel sketching artist pencils - set of 12 drawing pencils 5h to 6b","good product","catarina dasilva","pretty good pencils to sketch i like them",2020-12-18,5,"verified purchase"
"1273","royal & langnickel sketching artist pencils - set of 12 drawing pencils 5h to 6b","good product","andrew romano","use these for class and seem durable but they are a bit of a pain to sharpen",2019-02-09,5,"verified purchase"
"1274","royal & langnickel sketching artist pencils - set of 12 drawing pencils 5h to 6b","fast shipping  great product","amazon customer","product was shipped out right away and arrived in a timely manner really happy with my purchase will definitely be ordering again in the near future thanks",2022-10-19,5,"verified purchase"
"1275","royal & langnickel sketching artist pencils - set of 12 drawing pencils 5h to 6b","mala calidad","jlrr","no son unos buenos lpices cuando le sacas punta el grafito se parte me ha pasado con varios de los lpices no solo con uno no lo recomiendo",2022-09-29,5,"verified purchase"
"1276","royal & langnickel sketching artist pencils - set of 12 drawing pencils 5h to 6b","exactly what i ordered","mrs customer","these pencils are exactly what i ordered and the price was right ill be buying some more for the upcoming school year again",2023-05-29,1,"verified purchase"
"1277","royal & langnickel sketching artist pencils - set of 12 drawing pencils 5h to 6b","lot de crayons indispensables pour artiste","chriskaf","tous les modles des crayons  papier sont prsentsce qui est permet de raliser des dgrads et de ombres indispensable pour les artistes ",2020-08-16,5,"verified purchase"
"1278","royal & langnickel sketching artist pencils - set of 12 drawing pencils 5h to 6b","good quality","margaret desrochers","i find them easy to work with",2020-11-04,5,"verified purchase"
