"","prod_name","title","reviewer","review","date","ratings","type_of_purchase"
"1","staedtler 121-2 bk5d noris school graphite pencils - hb degree (pack of 5), black","supi","svenja","also ich find die finger gut schreibt malt alles top halt n bleistift",2023-06-30,4,"verified purchase"
"2","staedtler 121-2 bk5d noris school graphite pencils - hb degree (pack of 5), black","trs bien","marguerite et colibri","avoir plusieurs crayons papier de diffrents grains est vraiment utile selon lutilisation quon recherche ces crayons sont trs bien",2022-11-04,5,"verified purchase"
"3","staedtler 121-2 bk5d noris school graphite pencils - hb degree (pack of 5), black","caja de lapices completa","lorena","una caja de lpices stadler",2022-10-24,5,"verified purchase"
"4","staedtler 121-2 bk5d noris school graphite pencils - hb degree (pack of 5), black","good value pencils for when you want a harder lead","limner","this mixed pack of the reliable  staedtler noris pencils are good value you get a bbhbh and h in a blister pack i use these pencils for tracing and transferring designs where you need a solid hard lead i feel staedtlers grades are harder than other brands so look elsewhere for my soft sketching pencils saving these for where i need a clean line they sharpen and erase well dont break easily and keep their point well these are a good set for technical drawing and the occasions when you need a harder lead",2021-01-21,5,"verified purchase"
"5","staedtler 121-2 bk5d noris school graphite pencils - hb degree (pack of 5), black","quality","doris","as described perfect for crosswords nice and clear easy to sharpen and  soft enough to rub out quality",2023-12-27,5,"verified purchase"
"6","staedtler 121-2 bk5d noris school graphite pencils - hb degree (pack of 5), black","buena relacin calidadprecio","leo","es lo que yo quera un conjunto completo y de calidad por un buen precio",2023-12-13,5,"verified purchase"
"7","staedtler 121-2 bk5d noris school graphite pencils - hb degree (pack of 5), black","una vez que te acostumbras a los lapiceros de esta marca no cambias","leo","slo con el peso que tienen se nota que tienen una calidad estupenda son los lapiceros de todo la vida la dureza de la mina permite hacer los deberes sin problema",2023-11-05,5,"verified purchase"
"8","staedtler 121-2 bk5d noris school graphite pencils - hb degree (pack of 5), black","perfecto","chus","pack con lpices de todos los grafitos necesarios para plstica de  de la eso",2022-09-27,5,"verified purchase"
"9","staedtler 121-2 bk5d noris school graphite pencils - hb degree (pack of 5), black","perfekt","cliente amazon","perfekt",2023-06-10,5,"verified purchase"
"10","staedtler 121-2 bk5d noris school graphite pencils - hb degree (pack of 5), black","excellent pencils as always","rachid","sharpens well writes brilliantly recieved proper cedar pencils as opposed to the new upcycled wood version perfect item",2024-02-04,5,"verified purchase"
"11","staedtler 121-2 bk5d noris school graphite pencils - hb degree (pack of 5), black","nice and soft","homeschool mom","perfect for young kids to write without needing to put too much pressure on the paper",2023-09-17,4,"verified purchase"
"12","staedtler 121-2 bk5d noris school graphite pencils - hb degree (pack of 5), black","calidad precio","jennifer","vienen muchos y su calidad inmejorable",2023-03-02,5,"verified purchase"
"13","staedtler 121-2 bk5d noris school graphite pencils - hb degree (pack of 5), black","super","abello michelle","rien  redire",2023-03-13,5,"verified purchase"
"14","staedtler 121-2 bk5d noris school graphite pencils - hb degree (pack of 5), black","good","amazon customer","good quality",2020-12-09,5,"verified purchase"
"15","staedtler 121-2 bk5d noris school graphite pencils - hb degree (pack of 5), black"," matite hb pi  gomma","bluesky","a inizio marzo nella classe prima elementare di mio figlio le maestre sono passate dalla matita con scanalature alla matita hbne avevo una ma  poi rimasta in classe nellastuccio per cui mi sono attivata subito a cercare su amazon per proseguire con i compiti a casail prezzo  pi che adeguato alla qualit dellarticolo staedler per me  un nome una garanziasi consideri inoltre la piacevole sorpresa di aver trovato inclusa come da descrizione una gomma da cancellare ma molto grande cm x  vs la classica gomma da astuccio che misura cm x sono soddisfatta di questo mio acquisto per leccellente rapporto fra qualit prezzo e quantit matite pi gomma da cancellare in omaggio",2020-04-14,5,"verified purchase"
"16","staedtler 121-2 bk5d noris school graphite pencils - hb degree (pack of 5), black","produto de primeira qualidade","bluesky","amei esse produto tudo de primeira qualidade e a marca  top",2023-12-12,5,"verified purchase"
"17","staedtler 121-2 bk5d noris school graphite pencils - hb degree (pack of 5), black","my favorite pencils","elisangela","these are some of my alltime favorite pencils theyre perfect for drawing which is what i use them for the most so getting a goodsized pack of them is perfect",2023-06-26,5,"verified purchase"
"18","staedtler 121-2 bk5d noris school graphite pencils - hb degree (pack of 5), black","parfait","elizabeth h","forme triangulaire idalejadore ses crayons pour les enfants et moi mme",2024-01-24,5,"verified purchase"
"19","staedtler 121-2 bk5d noris school graphite pencils - hb degree (pack of 5), black","el clasico de siempre","emmeline","marca de toda la vida que te asegura calidad y durabilidad no busques ms no tiene rival",2023-10-21,5,"verified purchase"
"20","staedtler 121-2 bk5d noris school graphite pencils - hb degree (pack of 5), black","good set","juanadoo","purchased for child starting secondary has all the basics good price",2023-09-09,5,"verified purchase"
"21","staedtler 121-2 bk5d noris school graphite pencils - hb degree (pack of 5), black","good set","amazon customer","purchased for child starting secondary has all the basics good price",2023-09-09,4,"verified purchase"
"22","staedtler 121-2 bk5d noris school graphite pencils - hb degree (pack of 5), black","der klassiker","peter fischerhaaser","der klassiker unter den bleistiften eben ich mache trotz laptops smartphone  co meine notizen am lieben auf einem zettel mit einem bleistift   daher der klassiker vmtl seit  jahren in gelb  schwarz",2024-02-02,5,"verified purchase"
"23","staedtler 121-2 bk5d noris school graphite pencils - hb degree (pack of 5), black","lpices de muy buena calidad","jonathan gmez","lpices de muy buena calidad se los han pedido a mi hijo de  aos para sus clases y tienen muy buen agarre punta con mucha duracin y no se rompe fcilmente con la presin",2023-09-11,5,"verified purchase"
"24","staedtler 121-2 bk5d noris school graphite pencils - hb degree (pack of 5), black","matite ottime","roberto s","ottimo rapporto qualitprezzo suggerite anche per professione",2023-12-09,5,"verified purchase"
"25","staedtler 121-2 bk5d noris school graphite pencils - hb degree (pack of 5), black","de vrais bons crayons  papier solides et durables","jeanmarc","on trouve de tout en crayon  papier  tous les prix ces crayons ne sont pas les moins chers que lon puisse trouver mais le prix est plus que largement compens par leur qualit ces crayons sont solides tant la partie bois que la parie graphite si ils tombent la mine intrieure ne casse pas comme cest le cas sur les crayons bas de gamme lors de la taille le bois est proprement coup par la lame du taille crayon au lieu dtre dchiquet comme cest le cas aussi avec les produits bas de gamme le graphite utilis est de qualit permettant un taillage pointu ou plus rond la qualit dcriture est bien l a ne bave pas on ralise des tracs prcisidal aussi bien pour les adultes que pour les enfants qui ont tendance  les faire tomber frquemment et  les tailler souvent ",2016-02-12,5,"verified purchase"
"26","staedtler 121-2 bk5d noris school graphite pencils - hb degree (pack of 5), black","molto soddisfatto","aniello pagnotta","staedtler sinonimo di garanzia se si aggiunge il prezzo assolutamente inferiore a quanto trovato altrove la ricerca del materiale scolastico per il disegno non pu che ricadere su questo marchio",2023-12-13,5,"verified purchase"
"27","staedtler 121-2 bk5d noris school graphite pencils - hb degree (pack of 5), black","qualit e prezzo","rosy","ottime matite acquistate ad un buon prezzo",2019-10-10,5,"verified purchase"
"28","staedtler 121-2 bk5d noris school graphite pencils - hb degree (pack of 5), black","garanzia di qualit","aniello pagnotta","non  la prima volta che acquisto per mia figlia questo set di disegno staedtler e non posso dire altro che  come sempre una garanzia far cadere la propria scelta su questo marchio a questo si aggiunge il prezzo assolutamente inferiore a quanto trovato altrove che per i continui acquisti richiesti per il materiale scolastico non  da sottovalutare",2023-12-13,4,"verified purchase"
"29","staedtler 121-2 bk5d noris school graphite pencils - hb degree (pack of 5), black","love the quality ","lise","always love these pencils dont get them here in canada appreciate that the booghe store carries them and has quick reliable service",2021-03-14,5,"verified purchase"
"30","staedtler 121-2 bk5d noris school graphite pencils - hb degree (pack of 5), black","criture fluide","levasseur","top mon fils qui est au cp crit bien mieux avec ce genre de crayon quavec les standards achets prcdemment en commerce",2021-03-26,5,"verified purchase"
"31","staedtler 121-2 bk5d noris school graphite pencils - hb degree (pack of 5), black","produto de tima qualidade","fernando lus pinto","gaitei muito da qualidade dos lpis borracha e principalmente o apontador",2022-01-16,4,"verified purchase"
"32","staedtler 121-2 bk5d noris school graphite pencils - hb degree (pack of 5), black","trs bien","kakou","ma fille est ravie conforme  ce quelle souhaitais",2023-05-11,5,"verified purchase"
"33","staedtler 121-2 bk5d noris school graphite pencils - hb degree (pack of 5), black"," una matita","frozenfrz","sempre una garanzia usata per disegno tecnico scuola",2023-12-17,5,"verified purchase"
"34","staedtler 121-2 bk5d noris school graphite pencils - hb degree (pack of 5), black","buen material y buena marca","hugo bargiela gonzlez","buenos lpices y buena relacin calidad precio",2023-09-20,5,"verified purchase"
"35","staedtler 121-2 bk5d noris school graphite pencils - hb degree (pack of 5), black","great value pack","cobweb"," staedtler noris hb pencils   mm pack of  staedtler eraser  sharpener includedmade in germanycurrently at a bargain price via the amazon addon programme this represents great value to me especially for stocking up the stationery cupboard ahead of the busy springsummer seasoni also keep a pack in my bagjust in case a n other forgets theirsmeasuring around  cm x  cm x  cm the blister pack was bubblewrapped and secure in a strong cardboard outer for safe transitit contains  x full length readytouse hb pencils  x quality  goodsized mars plastic eraser         measuring around  cm x  cm x  cm which is wrapped in the pack along with  x standard onehole reasonable quality plastic sharpener blue in my packallowing for the bright red dipped end  nicely sharpened point each yellow  black stripy hexagonalbarrelled pencil measures around  cm out of the packon one side of the barrel in goldcoloured lettering made in germany  staedtler  noris  hb on another is the individual barcode detailfrom the pack efficient for ecology  wood from certified sustainably managed forestsooooo manufacturer detail high quality pencil for writing drawing and sketching ideal for school and office use unbelievably breakresistant through special lead formulation and superbonded lead  degrees available  bbhbhh wood from certified sustainably managed forests  images refer",2018-03-06,5,"verified purchase"
"36","staedtler 121-2 bk5d noris school graphite pencils - hb degree (pack of 5), black","ottimo prodotto","cobweb","buon prodotto buon rapporto qualit prezzo imballo perfetto",2020-10-27,5,"verified purchase"
"37","staedtler 121-2 bk5d noris school graphite pencils - hb degree (pack of 5), black","los lpices de toda la vida","borrelli ferdinando"," product overview hoy quiero compartir mi experiencia con el lpiz staedler noris este paquete de  lpices de dureza variada es la herramienta perfecta para aquellos que amamos dibujar tomar notas o simplemente disfrutar de la escritura a mano nuestra experiencia desde que adquir este set de lpices los he utilizado en diversas ocasiones y los resultados han sido sobresalientes he probado su uso en diferentes tipos de papel y el rendimiento es excepcional la suavidad con la que desliza el trazo es impresionante y permite un control absoluto sobre el grosor de las lneas adems el borrado es limpio y sin dejar rastros lo que me ha permitido realizar correcciones sin problemas destacados una de las caractersticas destacadas de este lpiz es su durabilidad a pesar de utilizarlos intensivamente no se gastan fcilmente y conservan su forma afilada por mucho tiempo lo cual es excelente para un dibujante como yo tambin me ha sorprendido la ergonoma de estos lpices ya que su diseo proporciona un agarre cmodo y facilita la escritura o el dibujo durante perodos prolongados de tiempo mejoras en cuanto a mejoras no he encontrado ninguna deficiencia significativa en estos lpices han cumplido con todas mis expectativas y no he tenido problemas con el producto hasta el momento relacin preciocalidad al evaluar la relacin preciocalidad de los lpices staedler noris considero que ofrecen una excelente relacin si bien su precio es ligeramente superior a otros lpices en el mercado la calidad y durabilidad que brindan compensan completamente ese aspecto adems al ser un paquete de  lpices su precio se vuelve an ms atractivo ya que obtienes una variedad de durezas en un solo paquete calificacin general en resumen mi experiencia con los lpices staedler noris ha sido sumamente positiva su calidad durabilidad y desempeo han superado mis expectativas no dudo en recomendarlos a cualquier persona que busque una herramienta de escritura o dibujo confiable y de alta calidad por todo lo anterior califico este producto con  estrellas y definitivamente contina siendo mi eleccin favorita para todas mis necesidades artsticas y de escritura una excelente adquisicin para cualquier amante del arte y la escritura a mano ",2023-10-13,5,"verified purchase"
"38","staedtler 121-2 bk5d noris school graphite pencils - hb degree (pack of 5), black","wie erwartet gut","lago","schnelle lieferung alles wie erwartet",2019-05-26,5,"verified purchase"
"39","staedtler 121-2 bk5d noris school graphite pencils - hb degree (pack of 5), black","perfect","anne","child uses for drawing easy to store fair price good quality",2024-01-03,5,"verified purchase"
"40","staedtler 121-2 bk5d noris school graphite pencils - hb degree (pack of 5), black","staedtler bleistift noris ","lisa","staedtler qualitt  preisleistung stimmt",2023-12-21,5,"verified purchase"
"41","staedtler 121-2 bk5d noris school graphite pencils - hb degree (pack of 5), black","lpices de los de siempre","mohamed faridi mohamed","compre estos lpices para mi hijo para el cole lpices como los que use yo en mi infancia siguen siendo los mismos con la misma calidad y resistentes y a un buen precio",2023-12-13,4,"verified purchase"
"42","staedtler 121-2 bk5d noris school graphite pencils - hb degree (pack of 5), black","ottimi lapis","davide","ottimi lapis hb con gommala mina  della giusta durezza non si sbriciola e non si scheggia si appuntano benissimo la qualit  garantitaformato conveniente  lapis ad un prezzo ottimo",2023-09-13,5,"verified purchase"
"43","staedtler 121-2 bk5d noris school graphite pencils - hb degree (pack of 5), black","matite","daniele","comprate perch richieste a scuola media dalla prof di arte prezzo molto conveniente e spedizione veloce",2022-12-04,5,"verified purchase"
"44","staedtler 121-2 bk5d noris school graphite pencils - hb degree (pack of 5), black","ottima scorta","leonardo","ho deciso di acquistare questa confezione di matite perch i miei bambini ne consumano tante alle elementari e volevo avere una scorta in casa devo dire che sono molto soddisfatto della qualit delle matite sono ben fatte hanno una mina morbida ma resistente e scrivono in modo fluido senza spezzarsi facilmente inoltre il prezzo  davvero conveniente per la quantit che si ricevesono perfette per luso scolastico e non solo",2023-01-08,5,"verified purchase"
"45","staedtler 121-2 bk5d noris school graphite pencils - hb degree (pack of 5), black","perfect","rogstrog","just perfect",2023-11-28,5,"verified purchase"
"46","staedtler 121-2 bk5d noris school graphite pencils - hb degree (pack of 5), black","son los lpices que nos recomienda la maestra de mi hija","yo","la verdad es que no se les rompe la punta  no emborronan la hoja ni ensucia los deberes y aprenden a escribir muy bien con ellos",2023-07-17,5,"verified purchase"
"47","staedtler 121-2 bk5d noris school graphite pencils - hb degree (pack of 5), black","bleistifte","jwang","das set bleistifte spitzer radiergummi ist optimal",2022-01-12,5,"verified purchase"
"48","staedtler 121-2 bk5d noris school graphite pencils - hb degree (pack of 5), black","le matite","lauretanov","queste sono le matite qualit classica e prodotto ineccepibile",2023-03-17,4,"verified purchase"
"49","staedtler 121-2 bk5d noris school graphite pencils - hb degree (pack of 5), black","ottimo articolo","ri","tutto come doveva essere prodotto corrispondente alla descrizione e arrivato nei tempi previsti articolo di ottima qualit che fa quel che deve la marca  una garanzia",2018-08-18,5,"verified purchase"
"50","staedtler 121-2 bk5d noris school graphite pencils - hb degree (pack of 5), black","buena calidad","juan","producto  excelente",2023-12-09,5,"verified purchase"
"51","staedtler noris school pencils hb [pack of 50) loose","originales a buen precio","pablo","es un producto que compr habitualmente y puedo asegurar que viene en la misma caja de   que vienen los originalesdespus de darle mucho uso las minas no se han roto a sacar punta ni una sola vez un gran producto a muy buen precio y con la comodidad de pedirlo en amazon",2019-02-06,4,"verified purchase"
"52","staedtler noris school pencils hb [pack of 50) loose","mine qui ne casse pas","lucie fernandes","la matresse de ma fille ma conseiller dacheter cette marque et depuis la mine ne casse plus cest la  me anne que jachte cette marque rapport qualit prix rien  dire  jai pu fournir toute sa classeje recommande ce produit",2019-11-02,5,"verified purchase"
"53","staedtler noris school pencils hb [pack of 50) loose","ein klassiker zum super preis","win","auch wenn auf dem stift noris school pencil steht ist es ein noris  jedoch zu einem sehr gnstigen preis von  cent pro stck die hrte von hb eignet sich sehr gut zum schreibenden noris gibts mittlerweile seit ber  jahren und es ist ein erstklassiger bleistift sauber gearbeitet farbige endkappe ber die man die hrte direkt erkennen kann recht mittig sitzende stabile mine und  man glaubt es kaum  noch made in germany",2017-04-28,5,"verified purchase"
"54","staedtler noris school pencils hb [pack of 50) loose","pencils  lots of them","professional procrastinator","not a lot you can say about this  the good quality of staedtler as you would expect and plenty of them  much better than many cheaper alternatives",2023-11-13,5,"verified purchase"
"55","staedtler noris school pencils hb [pack of 50) loose","prodotto di ottima qualit","chiarar","queste matite le conoscevo gi perch le ho sempre comprate ai miei ragazzi che frequentano la scuol elementarela mina  molto solida e quando viene rifatta la punta non si rompeimpugnatura piacevo e non scivolosa",2020-10-21,5,"verified purchase"
"56","staedtler noris school pencils hb [pack of 50) loose","good quality and worth your money","maynaga e","these pencils are legitimate staedtler pencils and are sturdy they all come sharpened and are ready to use",2023-06-27,5,"verified purchase"
"57","staedtler noris school pencils hb [pack of 50) loose","scorta per scuola","trix","ottimo acquisto e avendo tre figli in et scolare ho fatto scorta unica accortezza trasferirle in una scatola che le protegga dagli urti ottimo rapporto qualit prezzo",2022-11-20,5,"verified purchase"
"58","staedtler noris school pencils hb [pack of 50) loose","rsistant  un enfant ","aurlie","jai achet un stock de crayon de papier suite la surconsommation de ces derniers pas mon fils actuellement en cp perte machouillage excessif et la matresse demande un stock constant dans la trousseainsi pas de rupture dans la chane  pour linstant ils conviennent parfaitement  ce quon attend deux",2019-10-18,5,"verified purchase"
"59","staedtler noris school pencils hb [pack of 50) loose","einwandfreie ware","zumheulen","was hat mich das immer aufgeregt im bro in der werkstatt auf dem bau immer mal wieder verliert man ein bleistift und oder die billigen der discounter wo die mienen beim spitzen brechen oder von haus aus defekt sindhier erhlt man bis jetzt was ich sagen kann qualitt zu einem guten preis auch wenn ich hier erst einmal platz fr  stifte schaffen muss aber auch schn zu sehen was diese hndler an aufschlag haben unglaublich",2018-09-13,5,"verified purchase"
"60","staedtler noris school pencils hb [pack of 50) loose","gran pack familiar","jb","ideal para familias con hijos en edad escolar siempre me ha gustado esta marca son los mejores escriben y se borran bien y al sacarles punta la mina no se parte como en otros lpices adems es un pack de  que nos van a durar un par de cursos y a un precio muy bueno",2018-11-08,5,"verified purchase"
"61","staedtler noris school pencils hb [pack of 50) loose","pour tous","tas de lor dans les doigts","bons crayons de qualit prix trs abordable pour des staedtler achat rentabilis sur du long terme pour les coliers cest trs bien",2017-11-30,4,"verified purchase"
"62","staedtler noris school pencils hb [pack of 50) loose","stabil","bahlo","hch habe mir die bleistifte hauptschlich fr die werkstatt gekauft und hoffte dabei darauf dass ein markenname auch fr mehr qualitt sorgt ich wurde nicht enttuscht meine bisherigen bleistifte hatten die nette angewohnheit dass wenn sie einmal zu boden gefallen waren die mine innerhalb des bleistiftes mehrfach gebrochen war also war der stift immer nur wenige millimeter anspitzbar bis dann die mine wieder eine bruchstelle frei gab nicht diese stifte auch nach xmaligen herunterfallen in der werkstatt leider ein normales geschehen brach die mine noch bei keinem der stifte die dinger scheinen unzerstrbar abgesehen davon liegen sie gut in der hand und durch die auffllige farbgebung finde ich sie auch im werkstattchaos relativ einfach aber auch beim normalen schreibgebrauch sind diese stifte wirklich toll der abrieb der mine ist relativ gering so dass man nicht alle paar stze lang wieder nachspitzen muss nur eine kleinigkeit aber auch erwhnenswert die stifte kamen wunderbar gespitzt an also klasse bleistifte",2018-03-25,5,"verified purchase"
"63","staedtler noris school pencils hb [pack of 50) loose","calidad y precio muy bien","jillian","son los lpices de buena calidad y por la cantidad que viene el precio est muy bien aunque no se han roto ninguno creo que en el empaque que viene tendran que hacerlo ms resistente porque los lpices son delicados",2018-12-15,5,"verified purchase"
"64","staedtler noris school pencils hb [pack of 50) loose","matite ottime ed originali","roberta destino","matite ottime ed originali conferamato da steadtler  italia forse solo il pacco di spedizione era un poco scadente ma le matute erano tutte intatte e poi ad un prezzo del genere io ne comprerei a vagonate dato che nei negozi una sola matita costa da  a ",2018-05-30,4,"verified purchase"
"65","staedtler noris school pencils hb [pack of 50) loose","great value","chris barr","perfect",2023-09-08,5,"verified purchase"
"66","staedtler noris school pencils hb [pack of 50) loose","so many pencils","sammyjeev","lots and lots of pencils very sturdy and will last pretty much forever",2023-11-10,5,"verified purchase"
"67","staedtler noris school pencils hb [pack of 50) loose","estupendo","pili","lpices de toda la vida llegaron en su tiempo en una bolsa y dentro d una caja d amazon con todas las puntas vivasse borran bien y cuando les sacas punta queda afilada y no se rompe lpices para todo el curso de mis hijos y bastante econmicovolver a comprar",2018-10-06,5,"verified purchase"
"68","staedtler noris school pencils hb [pack of 50) loose","de bons crayons  papier","domi","je prfre de loin cette marque de crayons  papier criture visible se gomme bienpetit bmol le bout du crayon la partie rouge marque sur le papier donc il faut faire attention les enfants le passent rgulirement sur les feuilles et cest plus compliqu  gommer",2020-04-30,5,"verified purchase"
"69","staedtler noris school pencils hb [pack of 50) loose","preisleistung passt","amazon kunde","kann noch nicht viel sagen hab sie gestern erst bekommen",2019-09-20,4,"verified purchase"
"70","staedtler noris school pencils hb [pack of 50) loose","ottimo rapporto qualit prezzo ottima qualitoriginali matite staedtler","giovanni","ottimo rapporto qualit prezzo e ottima qualit delle matite se si vuole una matita hbunica pecca per sottolineare alcuni libri e tipi di carta sono preferibili le b",2021-05-30,4,"verified purchase"
"71","staedtler noris school pencils hb [pack of 50) loose","top","client damazon","trs bonne qualit",2020-06-29,4,"verified purchase"
